{
  "schema_version": 1,
  "id": "basics",
  "title": "根拠を確かめて判断する",
  "problems": [
    "FILE-WIN-DOUBLE-EXTENSION",
    "FILE-LINUX-SCRIPT-NAME",
    "PROC-WIN-SYSTEM-NAME",
    "WEB-MISLEADING-HOST",
    "WEB-LINK-MISMATCH",
    "EMAIL-DISPLAY-NAME",
    "EMAIL-ATTACHMENT-NAME",
    "AUTH-WIN-FAILURE-BURST",
    "PKG-PYPI-OBVIOUS-TYPO",
    "FILE-WIN-PUBLISHED-HASH",
    "FILE-WIN-KNOWN-HASH",
    "FILE-WIN-PUBLISHER",
    "FILE-WIN-EMBEDDED-DOMAIN",
    "FILE-WIN-ARCHIVE-CONTENTS",
    "FILE-LINUX-ELF-AS-DOCUMENT",
    "FILE-LINUX-PUBLISHED-HASH",
    "FILE-LINUX-KNOWN-HASH",
    "FILE-LINUX-ARCHIVE-MEMBERS",
    "FILE-LINUX-ELF-INTERPRETER",
    "PROC-WIN-HIGH-CPU",
    "PROC-WIN-IMAGE-PATH",
    "PROC-WIN-OFFICE-DOWNLOAD",
    "PROC-WIN-STARTUP-ENTRY",
    "PROC-WIN-BACKING-SIGNATURE",
    "PROC-WIN-BACKING-HASH",
    "PROC-LINUX-APPROVED-ARGS",
    "PROC-LINUX-WEB-CHILD",
    "PROC-LINUX-OPEN-PRIVATE-KEY",
    "PROC-LINUX-SOCKET-REPUTATION",
    "PROC-LINUX-SERVICE-UNIT",
    "PROC-LINUX-CRON-JOB",
    "WEB-WIN-DNS",
    "WEB-LINUX-DNS",
    "WEB-DOMAIN-REPUTATION",
    "WEB-URL-REPUTATION",
    "WEB-ISOLATED-REDIRECT",
    "NET-WIN-ACTIVE-APPROVED",
    "NET-WIN-IP-REPUTATION",
    "NET-WIN-PLAINTEXT-POST",
    "NET-LINUX-ACTIVE-APPROVED",
    "NET-LINUX-IP-REPUTATION",
    "NET-LINUX-PLAINTEXT-POST",
    "EMAIL-SERVICE-NOTICE",
    "EMAIL-REPLY-ADDRESS",
    "EMAIL-AUTH-FAILURE",
    "AUTH-WIN-SERVICE-INTERACTIVE",
    "AUTH-WIN-USUAL-LOGIN",
    "AUTH-WIN-REVOKED-DEVICE",
    "AUTH-LINUX-LOGIN-HISTORY",
    "AUTH-LINUX-SERVICE-LOGIN",
    "AUTH-LINUX-FAILURE-THRESHOLD",
    "PKG-PYPI-REGISTRY-METADATA",
    "PKG-NPM-REGISTRY-METADATA",
    "PKG-NPM-REPOSITORY-MISMATCH",
    "PKG-NPM-LOCKED-DEPENDENCY",
    "PKG-PYPI-KNOWN-VULNERABILITY",
    "FILE-WIN-MODIFIED-INSTALLER",
    "FILE-WIN-FAKE-UPDATE",
    "PROC-WIN-CLICKFIX",
    "PROC-WIN-DLL-SIDELOAD",
    "PROC-LINUX-CRON-PERSISTENCE",
    "EMAIL-BEC-DESTINATION",
    "AUTH-WIN-PASSWORD-SPRAY",
    "AUTH-WIN-RETIRED-USER",
    "AUTH-LINUX-SSH-PASSWORD-SPRAY",
    "PKG-NPM-SUBTLE-TYPO",
    "PKG-PYPI-DEPENDENCY-CONFUSION",
    "FILE-LINUX-ORDINARY-ELF",
    "PROC-WIN-LOLBIN",
    "EMAIL-BEC-REAL-ACCOUNT"
  ]
}
